{
  "type": "instance",
  "request_type": "create",
  "environment": "dev",
  "requested_by": "platform-team",
  "instance": {
    "name": "test-dr-cache",
    "shard_count": 1,
    "replica_count": 1,
    "server_type": "SHARED_CORE_NANO",
    "version": "VALKEY_9_0",
    "location": "us-east1",
    "cross_region_replica": true,
    "persistence": {
      "mode": "RDB"
    },
    "application_id": "platform-demo",
    "lob": "cc-0003",
    "tags": {
      "criticality": "high"
    },
    "enable_alerting": false,
    "appteam_emails": [
      "app-team-oncall@example.com"
    ]
  }
}