{
  "type": "instance",
  "request_type": "delete",
  "environment": "dev",
  "requested_by": "platform-team",
  "instance": {
    "name": "test-ha-cache",
    "shard_count": 1,
    "replica_count": 1,
    "server_type": "STANDARD_SMALL",
    "version": "VALKEY_9_0",
    "authorization_mode": "IAM_AUTH",
    "transit_encryption_mode": "SERVER_AUTHENTICATION",
    "cross_region_replica": false,
    "persistence": {
      "mode": "AOF"
    },
    "tags": {
      "application_id": "platform-demo",
      "lob": "cc-0002"
    },
    "enable_alerting": true,
    "appteam_emails": [
      "app-team-oncall@example.com"
    ]
  }
}